{
  "act_version": "0.1",
  "id": "sku-000311",
  "type": "product",
  "title": "Frost Headphone — Indigo",
  "summary": "Frost headphone in indigo; built in Vietnam for daily use.",
  "summary_source": "author",
  "parent": "catalog",
  "etag": "s256:f7Rq4bA2HedOwXQtx-Ti5p",
  "tokens": {
    "summary": 10,
    "body": 83
  },
  "content": [
    {
      "type": "prose",
      "format": "markdown",
      "text": "# Frost Headphone — Indigo\n\nBuilt for daily wear and refinishing. The Frost Headphone — Indigo is designed for the long haul, with audio-grade materials and a quiet, considered fit and finish.\n\n## Highlights\n\n- Crafted in Vietnam.\n- Repairable construction with serviceable parts.\n- Backed by a one-year materials warranty.\n\n## Care\n\nCondition every 60 days for best results. Spot-clean only; avoid harsh detergents. Store in a cool, dry place out of direct sunlight.",
      "metadata": {
        "extracted_via": "adapter"
      }
    },
    {
      "type": "data",
      "format": "json",
      "text": "{\"weight_g\":224,\"materials\":{\"upper\":\"waxed canvas\",\"sole\":\"crepe rubber\",\"lining\":\"cotton twill\"},\"care\":\"wipe with a damp cloth\",\"made_in\":\"Vietnam\",\"driver_mm\":40}",
      "value": {
        "weight_g": 224,
        "materials": {
          "upper": "waxed canvas",
          "sole": "crepe rubber",
          "lining": "cotton twill"
        },
        "care": "wipe with a damp cloth",
        "made_in": "Vietnam",
        "driver_mm": 40
      },
      "metadata": {
        "extracted_via": "adapter"
      }
    }
  ],
  "related": [
    {
      "id": "sku-000279",
      "relation": "see-also"
    },
    {
      "id": "sku-000287",
      "relation": "see-also"
    },
    {
      "id": "sku-000295",
      "relation": "see-also"
    },
    {
      "id": "sku-000303",
      "relation": "see-also"
    },
    {
      "id": "sku-000319",
      "relation": "see-also"
    },
    {
      "id": "sku-000327",
      "relation": "see-also"
    },
    {
      "id": "sku-000335",
      "relation": "see-also"
    },
    {
      "id": "sku-000343",
      "relation": "see-also"
    }
  ],
  "metadata": {
    "schema_org_type": "Product",
    "tags": [
      "audio",
      "made-in-vietnam",
      "indigo"
    ],
    "source": {
      "adapter": "act-catalog",
      "source_id": "sku-000311"
    }
  }
}