{
  "act_version": "0.1",
  "id": "sku-000196",
  "type": "product",
  "title": "Field Tent — Indigo",
  "summary": "Field tent in indigo; built in Japan for daily use.",
  "summary_source": "author",
  "parent": "catalog",
  "etag": "s256:_PG9R-R7VllJ8xtPksf80U",
  "tokens": {
    "summary": 10,
    "body": 83
  },
  "content": [
    {
      "type": "prose",
      "format": "markdown",
      "text": "# Field Tent — Indigo\n\nBuilt for daily wear and refinishing. The Field Tent — Indigo is designed for the long haul, with outdoor-grade materials and a quiet, considered fit and finish.\n\n## Highlights\n\n- Crafted in Japan.\n- Repairable construction with serviceable parts.\n- Backed by a one-year materials warranty.\n\n## Care\n\nCondition every 60 days for best results. Spot-clean only; avoid harsh detergents. Store in a cool, dry place out of direct sunlight.",
      "metadata": {
        "extracted_via": "adapter"
      }
    },
    {
      "type": "data",
      "format": "json",
      "text": "{\"weight_g\":1648,\"materials\":{\"upper\":\"waxed canvas\",\"sole\":\"crepe rubber\",\"lining\":\"cotton twill\"},\"care\":\"wipe with a damp cloth\",\"made_in\":\"Japan\",\"capacity\":\"4-person\"}",
      "value": {
        "weight_g": 1648,
        "materials": {
          "upper": "waxed canvas",
          "sole": "crepe rubber",
          "lining": "cotton twill"
        },
        "care": "wipe with a damp cloth",
        "made_in": "Japan",
        "capacity": "4-person"
      },
      "metadata": {
        "extracted_via": "adapter"
      }
    }
  ],
  "related": [
    {
      "id": "sku-000164",
      "relation": "see-also"
    },
    {
      "id": "sku-000172",
      "relation": "see-also"
    },
    {
      "id": "sku-000180",
      "relation": "see-also"
    },
    {
      "id": "sku-000188",
      "relation": "see-also"
    },
    {
      "id": "sku-000204",
      "relation": "see-also"
    },
    {
      "id": "sku-000212",
      "relation": "see-also"
    },
    {
      "id": "sku-000220",
      "relation": "see-also"
    },
    {
      "id": "sku-000228",
      "relation": "see-also"
    }
  ],
  "metadata": {
    "schema_org_type": "Product",
    "tags": [
      "outdoor",
      "made-in-japan",
      "indigo"
    ],
    "source": {
      "adapter": "act-catalog",
      "source_id": "sku-000196"
    }
  }
}