{
  "act_version": "0.1",
  "id": "sku-000488",
  "type": "product",
  "title": "Granite Boot — Slate",
  "summary": "Granite boot in slate; built in United States for daily use.",
  "summary_source": "author",
  "parent": "catalog",
  "etag": "s256:8FRcdCfWTL4N6t-aXylcDP",
  "tokens": {
    "summary": 11,
    "body": 85
  },
  "content": [
    {
      "type": "prose",
      "format": "markdown",
      "text": "# Granite Boot — Slate\n\nBuilt for daily wear and refinishing. The Granite Boot — Slate is designed for the long haul, with footwear-grade materials and a quiet, considered fit and finish.\n\n## Highlights\n\n- Crafted in United States.\n- Repairable construction with serviceable parts.\n- Backed by a one-year materials warranty.\n\n## Care\n\nCondition every 60 days for best results. Spot-clean only; avoid harsh detergents. Store in a cool, dry place out of direct sunlight.",
      "metadata": {
        "extracted_via": "adapter"
      }
    },
    {
      "type": "data",
      "format": "json",
      "text": "{\"weight_g\":1660,\"materials\":{\"upper\":\"recycled paper\",\"sole\":\"cloth binding\",\"lining\":\"lay-flat spine\"},\"care\":\"wipe with a damp cloth\",\"made_in\":\"United States\",\"sizes_us\":[8,8.5,9,9.5,10,10.5,11,11.5,12]}",
      "value": {
        "weight_g": 1660,
        "materials": {
          "upper": "recycled paper",
          "sole": "cloth binding",
          "lining": "lay-flat spine"
        },
        "care": "wipe with a damp cloth",
        "made_in": "United States",
        "sizes_us": [
          8,
          8.5,
          9,
          9.5,
          10,
          10.5,
          11,
          11.5,
          12
        ]
      },
      "metadata": {
        "extracted_via": "adapter"
      }
    }
  ],
  "related": [
    {
      "id": "sku-000456",
      "relation": "see-also"
    },
    {
      "id": "sku-000464",
      "relation": "see-also"
    },
    {
      "id": "sku-000472",
      "relation": "see-also"
    },
    {
      "id": "sku-000480",
      "relation": "see-also"
    },
    {
      "id": "sku-000496",
      "relation": "see-also"
    }
  ],
  "metadata": {
    "schema_org_type": "Product",
    "tags": [
      "footwear",
      "made-in-united-states",
      "slate"
    ],
    "source": {
      "adapter": "act-catalog",
      "source_id": "sku-000488"
    }
  }
}