{
  "act_version": "0.1",
  "id": "sku-000193",
  "type": "product",
  "title": "Granite Jacket — Storm",
  "summary": "Granite jacket in storm; built in Mexico for daily use.",
  "summary_source": "author",
  "parent": "catalog",
  "etag": "s256:A_Fy6X3QBCt01nEm1dqjTV",
  "tokens": {
    "summary": 10,
    "body": 83
  },
  "content": [
    {
      "type": "prose",
      "format": "markdown",
      "text": "# Granite Jacket — Storm\n\nBuilt for daily wear and refinishing. The Granite Jacket — Storm is designed for the long haul, with apparel-grade materials and a quiet, considered fit and finish.\n\n## Highlights\n\n- Crafted in Mexico.\n- Repairable construction with serviceable parts.\n- Backed by a one-year materials warranty.\n\n## Care\n\nCondition every 60 days for best results. Spot-clean only; avoid harsh detergents. Store in a cool, dry place out of direct sunlight.",
      "metadata": {
        "extracted_via": "adapter"
      }
    },
    {
      "type": "data",
      "format": "json",
      "text": "{\"weight_g\":815,\"materials\":{\"upper\":\"steel chassis\",\"sole\":\"machined aluminum\",\"lining\":\"frosted glass\"},\"care\":\"wipe with a damp cloth\",\"made_in\":\"Mexico\",\"sizes_us\":[8,8.5,9,9.5,10,10.5,11,11.5,12]}",
      "value": {
        "weight_g": 815,
        "materials": {
          "upper": "steel chassis",
          "sole": "machined aluminum",
          "lining": "frosted glass"
        },
        "care": "wipe with a damp cloth",
        "made_in": "Mexico",
        "sizes_us": [
          8,
          8.5,
          9,
          9.5,
          10,
          10.5,
          11,
          11.5,
          12
        ]
      },
      "metadata": {
        "extracted_via": "adapter"
      }
    }
  ],
  "related": [
    {
      "id": "sku-000161",
      "relation": "see-also"
    },
    {
      "id": "sku-000169",
      "relation": "see-also"
    },
    {
      "id": "sku-000177",
      "relation": "see-also"
    },
    {
      "id": "sku-000185",
      "relation": "see-also"
    },
    {
      "id": "sku-000201",
      "relation": "see-also"
    },
    {
      "id": "sku-000209",
      "relation": "see-also"
    },
    {
      "id": "sku-000217",
      "relation": "see-also"
    },
    {
      "id": "sku-000225",
      "relation": "see-also"
    }
  ],
  "metadata": {
    "schema_org_type": "Product",
    "tags": [
      "apparel",
      "made-in-mexico",
      "storm"
    ],
    "source": {
      "adapter": "act-catalog",
      "source_id": "sku-000193"
    }
  }
}