{
  "act_version": "0.1",
  "id": "sku-000091",
  "type": "product",
  "title": "Heritage Wrench — Slate",
  "summary": "Heritage wrench in slate; built in United States for daily use.",
  "summary_source": "author",
  "parent": "catalog",
  "etag": "s256:v1TfFlRp_Bf4bwx7XLXuF6",
  "tokens": {
    "summary": 11,
    "body": 86
  },
  "content": [
    {
      "type": "prose",
      "format": "markdown",
      "text": "# Heritage Wrench — Slate\n\nBuilt for daily wear and refinishing. The Heritage Wrench — Slate is designed for the long haul, with tools-grade materials and a quiet, considered fit and finish.\n\n## Highlights\n\n- Crafted in United States.\n- Repairable construction with serviceable parts.\n- Backed by a one-year materials warranty.\n\n## Care\n\nCondition every 60 days for best results. Spot-clean only; avoid harsh detergents. Store in a cool, dry place out of direct sunlight.",
      "metadata": {
        "extracted_via": "adapter"
      }
    },
    {
      "type": "data",
      "format": "json",
      "text": "{\"weight_g\":539,\"materials\":{\"upper\":\"cast iron\",\"sole\":\"forged steel\",\"lining\":\"enameled cast iron\"},\"care\":\"wipe with a damp cloth\",\"made_in\":\"United States\",\"length_cm\":24}",
      "value": {
        "weight_g": 539,
        "materials": {
          "upper": "cast iron",
          "sole": "forged steel",
          "lining": "enameled cast iron"
        },
        "care": "wipe with a damp cloth",
        "made_in": "United States",
        "length_cm": 24
      },
      "metadata": {
        "extracted_via": "adapter"
      }
    }
  ],
  "related": [
    {
      "id": "sku-000059",
      "relation": "see-also"
    },
    {
      "id": "sku-000067",
      "relation": "see-also"
    },
    {
      "id": "sku-000075",
      "relation": "see-also"
    },
    {
      "id": "sku-000083",
      "relation": "see-also"
    },
    {
      "id": "sku-000099",
      "relation": "see-also"
    },
    {
      "id": "sku-000107",
      "relation": "see-also"
    },
    {
      "id": "sku-000115",
      "relation": "see-also"
    },
    {
      "id": "sku-000123",
      "relation": "see-also"
    }
  ],
  "metadata": {
    "schema_org_type": "Product",
    "tags": [
      "tools",
      "made-in-united-states",
      "slate"
    ],
    "source": {
      "adapter": "act-catalog",
      "source_id": "sku-000091"
    }
  }
}