{
  "act_version": "0.1",
  "id": "sku-000078",
  "type": "product",
  "title": "Onyx Lamp — Indigo",
  "summary": "Onyx lamp in indigo; built in Canada for daily use.",
  "summary_source": "author",
  "parent": "catalog",
  "etag": "s256:0TRcoN_tRU42Nc3fZ3fiER",
  "tokens": {
    "summary": 10,
    "body": 83
  },
  "content": [
    {
      "type": "prose",
      "format": "markdown",
      "text": "# Onyx Lamp — Indigo\n\nBuilt for daily wear and refinishing. The Onyx Lamp — Indigo is designed for the long haul, with lighting-grade materials and a quiet, considered fit and finish.\n\n## Highlights\n\n- Crafted in Canada.\n- Repairable construction with serviceable parts.\n- Backed by a one-year materials warranty.\n\n## Care\n\nCondition every 60 days for best results. Spot-clean only; avoid harsh detergents. Store in a cool, dry place out of direct sunlight.",
      "metadata": {
        "extracted_via": "adapter"
      }
    },
    {
      "type": "data",
      "format": "json",
      "text": "{\"weight_g\":1349,\"materials\":{\"upper\":\"full-grain leather\",\"sole\":\"oak-tanned leather\",\"lining\":\"vegetable-tanned calfskin\"},\"care\":\"wipe with a damp cloth\",\"made_in\":\"Canada\",\"wattage_w\":17}",
      "value": {
        "weight_g": 1349,
        "materials": {
          "upper": "full-grain leather",
          "sole": "oak-tanned leather",
          "lining": "vegetable-tanned calfskin"
        },
        "care": "wipe with a damp cloth",
        "made_in": "Canada",
        "wattage_w": 17
      },
      "metadata": {
        "extracted_via": "adapter"
      }
    }
  ],
  "related": [
    {
      "id": "sku-000046",
      "relation": "see-also"
    },
    {
      "id": "sku-000054",
      "relation": "see-also"
    },
    {
      "id": "sku-000062",
      "relation": "see-also"
    },
    {
      "id": "sku-000070",
      "relation": "see-also"
    },
    {
      "id": "sku-000086",
      "relation": "see-also"
    },
    {
      "id": "sku-000094",
      "relation": "see-also"
    },
    {
      "id": "sku-000102",
      "relation": "see-also"
    },
    {
      "id": "sku-000110",
      "relation": "see-also"
    }
  ],
  "metadata": {
    "schema_org_type": "Product",
    "tags": [
      "lighting",
      "made-in-canada",
      "indigo"
    ],
    "source": {
      "adapter": "act-catalog",
      "source_id": "sku-000078"
    }
  }
}