{
  "act_version": "0.1",
  "id": "recipes/performance/request-coalescing-sdk-node",
  "type": "recipe",
  "title": "Request coalescing sdk node (Performance)",
  "summary": "Request coalescing sdk node — performance workflow walkthrough.",
  "summary_source": "author",
  "content": [
    {
      "type": "prose",
      "format": "markdown",
      "text": "Goal"
    },
    {
      "type": "prose",
      "format": "markdown",
      "text": "Demonstrate \"request coalescing (sdk node)\" against the Tinybox performance surface end to end."
    },
    {
      "type": "prose",
      "format": "markdown",
      "text": "Walkthrough"
    },
    {
      "type": "code",
      "language": "bash",
      "text": "# Step 1 — prepare a bucket for the performance workflow.\ntinybox buckets create my-bucket --region us-east-1"
    },
    {
      "type": "prose",
      "format": "markdown",
      "text": "Apply the recipe; verify with the API reference under API reference."
    }
  ],
  "tokens": {
    "summary": 8,
    "body": 47
  },
  "metadata": {
    "source": {
      "adapter": "act-docusaurus-sidebar-synthesizer",
      "source_id": "recipes/performance/request-coalescing-sdk-node.md",
      "source_path": "/Users/jforsythe/dev/ai/act/examples/docusaurus-docs/docs/recipes/performance/request-coalescing-sdk-node.md"
    }
  },
  "etag": "s256:WUJxXhCTtvnc2TDuMw2l_d",
  "parent": "performance"
}