{
  "act_version": "0.1",
  "id": "sku-000329",
  "type": "product",
  "title": "Studio Jacket — Slate",
  "summary": "Studio jacket in slate; built in United States for daily use.",
  "summary_source": "author",
  "parent": "catalog",
  "etag": "s256:UBKHx4LX2Q5ydA58vleztg",
  "tokens": {
    "summary": 11,
    "body": 85
  },
  "content": [
    {
      "type": "prose",
      "format": "markdown",
      "text": "# Studio Jacket — Slate\n\nBuilt for daily wear and refinishing. The Studio Jacket — Slate is designed for the long haul, with apparel-grade materials and a quiet, considered fit and finish.\n\n## Highlights\n\n- Crafted in United States.\n- Repairable construction with serviceable parts.\n- Backed by a one-year materials warranty.\n\n## Care\n\nCondition every 60 days for best results. Spot-clean only; avoid harsh detergents. Store in a cool, dry place out of direct sunlight.",
      "metadata": {
        "extracted_via": "adapter"
      }
    },
    {
      "type": "data",
      "format": "json",
      "text": "{\"weight_g\":1902,\"materials\":{\"upper\":\"steel chassis\",\"sole\":\"machined aluminum\",\"lining\":\"frosted glass\"},\"care\":\"wipe with a damp cloth\",\"made_in\":\"United States\",\"sizes_us\":[8,8.5,9,9.5,10,10.5,11,11.5,12]}",
      "value": {
        "weight_g": 1902,
        "materials": {
          "upper": "steel chassis",
          "sole": "machined aluminum",
          "lining": "frosted glass"
        },
        "care": "wipe with a damp cloth",
        "made_in": "United States",
        "sizes_us": [
          8,
          8.5,
          9,
          9.5,
          10,
          10.5,
          11,
          11.5,
          12
        ]
      },
      "metadata": {
        "extracted_via": "adapter"
      }
    }
  ],
  "related": [
    {
      "id": "sku-000297",
      "relation": "see-also"
    },
    {
      "id": "sku-000305",
      "relation": "see-also"
    },
    {
      "id": "sku-000313",
      "relation": "see-also"
    },
    {
      "id": "sku-000321",
      "relation": "see-also"
    },
    {
      "id": "sku-000337",
      "relation": "see-also"
    },
    {
      "id": "sku-000345",
      "relation": "see-also"
    },
    {
      "id": "sku-000353",
      "relation": "see-also"
    },
    {
      "id": "sku-000361",
      "relation": "see-also"
    }
  ],
  "metadata": {
    "schema_org_type": "Product",
    "tags": [
      "apparel",
      "made-in-united-states",
      "slate"
    ],
    "source": {
      "adapter": "act-catalog",
      "source_id": "sku-000329"
    }
  }
}