{
  "act_version": "0.1",
  "id": "sku-000106",
  "type": "product",
  "title": "Harvest Skillet — Russet",
  "summary": "Harvest skillet in russet; built in United States for daily use.",
  "summary_source": "author",
  "parent": "catalog",
  "etag": "s256:5IFBbphCmnnaqu4nMMN7qG",
  "tokens": {
    "summary": 11,
    "body": 85
  },
  "content": [
    {
      "type": "prose",
      "format": "markdown",
      "text": "# Harvest Skillet — Russet\n\nBuilt for daily wear and refinishing. The Harvest Skillet — Russet is designed for the long haul, with kitchen-grade materials and a quiet, considered fit and finish.\n\n## Highlights\n\n- Crafted in United States.\n- Repairable construction with serviceable parts.\n- Backed by a one-year materials warranty.\n\n## Care\n\nCondition every 60 days for best results. Spot-clean only; avoid harsh detergents. Store in a cool, dry place out of direct sunlight.",
      "metadata": {
        "extracted_via": "adapter"
      }
    },
    {
      "type": "data",
      "format": "json",
      "text": "{\"weight_g\":1877,\"materials\":{\"upper\":\"ripstop nylon\",\"sole\":\"aluminum poles\",\"lining\":\"mesh inner\"},\"care\":\"wipe with a damp cloth\",\"made_in\":\"United States\",\"diameter_cm\":21}",
      "value": {
        "weight_g": 1877,
        "materials": {
          "upper": "ripstop nylon",
          "sole": "aluminum poles",
          "lining": "mesh inner"
        },
        "care": "wipe with a damp cloth",
        "made_in": "United States",
        "diameter_cm": 21
      },
      "metadata": {
        "extracted_via": "adapter"
      }
    }
  ],
  "related": [
    {
      "id": "sku-000074",
      "relation": "see-also"
    },
    {
      "id": "sku-000082",
      "relation": "see-also"
    },
    {
      "id": "sku-000090",
      "relation": "see-also"
    },
    {
      "id": "sku-000098",
      "relation": "see-also"
    },
    {
      "id": "sku-000114",
      "relation": "see-also"
    },
    {
      "id": "sku-000122",
      "relation": "see-also"
    },
    {
      "id": "sku-000130",
      "relation": "see-also"
    },
    {
      "id": "sku-000138",
      "relation": "see-also"
    }
  ],
  "metadata": {
    "schema_org_type": "Product",
    "tags": [
      "kitchen",
      "made-in-united-states",
      "russet"
    ],
    "source": {
      "adapter": "act-catalog",
      "source_id": "sku-000106"
    }
  }
}