{
  "act_version": "0.1",
  "id": "recipes/security/encrypt-at-rest-cli",
  "type": "recipe",
  "title": "Encrypt at rest cli (Security)",
  "summary": "Encrypt at rest cli — security workflow walkthrough.",
  "summary_source": "author",
  "content": [
    {
      "type": "prose",
      "format": "markdown",
      "text": "Goal"
    },
    {
      "type": "prose",
      "format": "markdown",
      "text": "Demonstrate \"encrypt at rest (cli)\" against the Tinybox security surface end to end."
    },
    {
      "type": "prose",
      "format": "markdown",
      "text": "Walkthrough"
    },
    {
      "type": "code",
      "language": "bash",
      "text": "# Step 1 — prepare a bucket for the security workflow.\ntinybox buckets create my-bucket --region us-east-1"
    },
    {
      "type": "prose",
      "format": "markdown",
      "text": "Apply the recipe; verify with the API reference under API reference."
    }
  ],
  "tokens": {
    "summary": 8,
    "body": 47
  },
  "metadata": {
    "source": {
      "adapter": "act-docusaurus-sidebar-synthesizer",
      "source_id": "recipes/security/encrypt-at-rest-cli.md",
      "source_path": "/Users/jforsythe/dev/ai/act/examples/docusaurus-docs/docs/recipes/security/encrypt-at-rest-cli.md"
    }
  },
  "etag": "s256:21GyPhFJDfKAnb9OFvZrfo",
  "parent": "security"
}