{
  "act_version": "0.1",
  "id": "sku-000464",
  "type": "product",
  "title": "Coastal Boot — Walnut",
  "summary": "Coastal boot in walnut; built in Japan for daily use.",
  "summary_source": "author",
  "parent": "catalog",
  "etag": "s256:q2mi1z_AKhmW2ImjiyiQTc",
  "tokens": {
    "summary": 10,
    "body": 83
  },
  "content": [
    {
      "type": "prose",
      "format": "markdown",
      "text": "# Coastal Boot — Walnut\n\nBuilt for daily wear and refinishing. The Coastal Boot — Walnut is designed for the long haul, with footwear-grade materials and a quiet, considered fit and finish.\n\n## Highlights\n\n- Crafted in Japan.\n- Repairable construction with serviceable parts.\n- Backed by a one-year materials warranty.\n\n## Care\n\nCondition every 60 days for best results. Spot-clean only; avoid harsh detergents. Store in a cool, dry place out of direct sunlight.",
      "metadata": {
        "extracted_via": "adapter"
      }
    },
    {
      "type": "data",
      "format": "json",
      "text": "{\"weight_g\":1581,\"materials\":{\"upper\":\"chrome vanadium\",\"sole\":\"rubberized grip\",\"lining\":\"powder coat\"},\"care\":\"wipe with a damp cloth\",\"made_in\":\"Japan\",\"sizes_us\":[8,8.5,9,9.5,10,10.5,11,11.5,12]}",
      "value": {
        "weight_g": 1581,
        "materials": {
          "upper": "chrome vanadium",
          "sole": "rubberized grip",
          "lining": "powder coat"
        },
        "care": "wipe with a damp cloth",
        "made_in": "Japan",
        "sizes_us": [
          8,
          8.5,
          9,
          9.5,
          10,
          10.5,
          11,
          11.5,
          12
        ]
      },
      "metadata": {
        "extracted_via": "adapter"
      }
    }
  ],
  "related": [
    {
      "id": "sku-000432",
      "relation": "see-also"
    },
    {
      "id": "sku-000440",
      "relation": "see-also"
    },
    {
      "id": "sku-000448",
      "relation": "see-also"
    },
    {
      "id": "sku-000456",
      "relation": "see-also"
    },
    {
      "id": "sku-000472",
      "relation": "see-also"
    },
    {
      "id": "sku-000480",
      "relation": "see-also"
    },
    {
      "id": "sku-000488",
      "relation": "see-also"
    },
    {
      "id": "sku-000496",
      "relation": "see-also"
    }
  ],
  "metadata": {
    "schema_org_type": "Product",
    "tags": [
      "footwear",
      "made-in-japan",
      "walnut"
    ],
    "source": {
      "adapter": "act-catalog",
      "source_id": "sku-000464"
    }
  }
}