{
  "act_version": "0.1",
  "id": "sku-000364",
  "type": "product",
  "title": "Aurora Tent — Brick",
  "summary": "Aurora tent in brick; built in United States for daily use.",
  "summary_source": "author",
  "parent": "catalog",
  "etag": "s256:rRFqJh7bz8uM4w1cWepNab",
  "tokens": {
    "summary": 11,
    "body": 86
  },
  "content": [
    {
      "type": "prose",
      "format": "markdown",
      "text": "# Aurora Tent — Brick\n\nBuilt for daily wear and refinishing. The Aurora Tent — Brick is designed for the long haul, with outdoor-grade materials and a quiet, considered fit and finish.\n\n## Highlights\n\n- Crafted in United States.\n- Repairable construction with serviceable parts.\n- Backed by a one-year materials warranty.\n\n## Care\n\nCondition every 60 days for best results. Spot-clean only; avoid harsh detergents. Store in a cool, dry place out of direct sunlight.",
      "metadata": {
        "extracted_via": "adapter"
      }
    },
    {
      "type": "data",
      "format": "json",
      "text": "{\"weight_g\":991,\"materials\":{\"upper\":\"cast iron\",\"sole\":\"forged steel\",\"lining\":\"enameled cast iron\"},\"care\":\"wipe with a damp cloth\",\"made_in\":\"United States\",\"capacity\":\"3-person\"}",
      "value": {
        "weight_g": 991,
        "materials": {
          "upper": "cast iron",
          "sole": "forged steel",
          "lining": "enameled cast iron"
        },
        "care": "wipe with a damp cloth",
        "made_in": "United States",
        "capacity": "3-person"
      },
      "metadata": {
        "extracted_via": "adapter"
      }
    }
  ],
  "related": [
    {
      "id": "sku-000332",
      "relation": "see-also"
    },
    {
      "id": "sku-000340",
      "relation": "see-also"
    },
    {
      "id": "sku-000348",
      "relation": "see-also"
    },
    {
      "id": "sku-000356",
      "relation": "see-also"
    },
    {
      "id": "sku-000372",
      "relation": "see-also"
    },
    {
      "id": "sku-000380",
      "relation": "see-also"
    },
    {
      "id": "sku-000388",
      "relation": "see-also"
    },
    {
      "id": "sku-000396",
      "relation": "see-also"
    }
  ],
  "metadata": {
    "schema_org_type": "Product",
    "tags": [
      "outdoor",
      "made-in-united-states",
      "brick"
    ],
    "source": {
      "adapter": "act-catalog",
      "source_id": "sku-000364"
    }
  }
}