{
  "act_version": "0.1",
  "id": "troubleshooting/billing/plan-downgrade-blocked-reproduction",
  "type": "troubleshooting",
  "title": "Plan downgrade blocked reproduction (Billing)",
  "summary": "Resolve \"plan downgrade blocked\" — reproduction for the Billing surface.",
  "summary_source": "author",
  "content": [
    {
      "type": "prose",
      "format": "markdown",
      "text": "Symptom"
    },
    {
      "type": "prose",
      "format": "markdown",
      "text": "An operation against the Billing surface fails with an error matching \"plan downgrade blocked (reproduction)\"."
    },
    {
      "type": "prose",
      "format": "markdown",
      "text": "Resolution"
    },
    {
      "type": "prose",
      "format": "markdown",
      "text": "Inspect the error envelope.Re-issue with corrected parameters.Confirm via the audit log."
    },
    {
      "type": "prose",
      "format": "markdown",
      "text": "See the Billing API reference for the exact field set."
    }
  ],
  "tokens": {
    "summary": 10,
    "body": 45
  },
  "metadata": {
    "source": {
      "adapter": "act-docusaurus-sidebar-synthesizer",
      "source_id": "troubleshooting/billing/plan-downgrade-blocked-reproduction.md",
      "source_path": "/Users/jforsythe/dev/ai/act/examples/docusaurus-docs/docs/troubleshooting/billing/plan-downgrade-blocked-reproduction.md"
    }
  },
  "etag": "s256:3u_ZZNMD5dwdj00XDn6SI8",
  "parent": "billing-issues"
}