{
  "act_version": "0.1",
  "id": "sku-000007",
  "type": "product",
  "title": "Field Headphone — Ochre",
  "summary": "Field headphone in ochre; built in Portugal for daily use.",
  "summary_source": "author",
  "parent": "catalog",
  "etag": "s256:PI6gQBPucmuLzMmxH-5U1q",
  "tokens": {
    "summary": 10,
    "body": 83
  },
  "content": [
    {
      "type": "prose",
      "format": "markdown",
      "text": "# Field Headphone — Ochre\n\nBuilt for daily wear and refinishing. The Field Headphone — Ochre is designed for the long haul, with audio-grade materials and a quiet, considered fit and finish.\n\n## Highlights\n\n- Crafted in Portugal.\n- Repairable construction with serviceable parts.\n- Backed by a one-year materials warranty.\n\n## Care\n\nCondition every 60 days for best results. Spot-clean only; avoid harsh detergents. Store in a cool, dry place out of direct sunlight.",
      "metadata": {
        "extracted_via": "adapter"
      }
    },
    {
      "type": "data",
      "format": "json",
      "text": "{\"weight_g\":664,\"materials\":{\"upper\":\"ripstop nylon\",\"sole\":\"aluminum poles\",\"lining\":\"mesh inner\"},\"care\":\"wipe with a damp cloth\",\"made_in\":\"Portugal\",\"driver_mm\":53}",
      "value": {
        "weight_g": 664,
        "materials": {
          "upper": "ripstop nylon",
          "sole": "aluminum poles",
          "lining": "mesh inner"
        },
        "care": "wipe with a damp cloth",
        "made_in": "Portugal",
        "driver_mm": 53
      },
      "metadata": {
        "extracted_via": "adapter"
      }
    }
  ],
  "related": [
    {
      "id": "sku-000015",
      "relation": "see-also"
    },
    {
      "id": "sku-000023",
      "relation": "see-also"
    },
    {
      "id": "sku-000031",
      "relation": "see-also"
    },
    {
      "id": "sku-000039",
      "relation": "see-also"
    }
  ],
  "metadata": {
    "schema_org_type": "Product",
    "tags": [
      "audio",
      "made-in-portugal",
      "ochre"
    ],
    "source": {
      "adapter": "act-catalog",
      "source_id": "sku-000007"
    }
  }
}