{
  "act_version": "0.1",
  "id": "recipes/ingestion/content-md5-verification-sdk-node",
  "type": "recipe",
  "title": "Content md5 verification sdk node (Ingestion)",
  "summary": "Content md5 verification sdk node — ingestion workflow walkthrough.",
  "summary_source": "author",
  "content": [
    {
      "type": "prose",
      "format": "markdown",
      "text": "Goal"
    },
    {
      "type": "prose",
      "format": "markdown",
      "text": "Demonstrate \"content md5 verification (sdk node)\" against the Tinybox ingestion surface end to end."
    },
    {
      "type": "prose",
      "format": "markdown",
      "text": "Walkthrough"
    },
    {
      "type": "code",
      "language": "bash",
      "text": "# Step 1 — prepare a bucket for the ingestion workflow.\ntinybox buckets create my-bucket --region us-east-1"
    },
    {
      "type": "prose",
      "format": "markdown",
      "text": "Apply the recipe; verify with the API reference under API reference."
    }
  ],
  "tokens": {
    "summary": 9,
    "body": 48
  },
  "metadata": {
    "source": {
      "adapter": "act-docusaurus-sidebar-synthesizer",
      "source_id": "recipes/ingestion/content-md5-verification-sdk-node.md",
      "source_path": "/Users/jforsythe/dev/ai/act/examples/docusaurus-docs/docs/recipes/ingestion/content-md5-verification-sdk-node.md"
    }
  },
  "etag": "s256:00Em_yeeT5xEzgRwRcSPFz",
  "parent": "ingestion"
}