{
  "act_version": "0.1",
  "id": "sku-000129",
  "type": "product",
  "title": "Harvest Jacket — Walnut",
  "summary": "Harvest jacket in walnut; built in Italy for daily use.",
  "summary_source": "author",
  "parent": "catalog",
  "etag": "s256:IxDSn3VWn-A1GeVDmEL9i5",
  "tokens": {
    "summary": 10,
    "body": 83
  },
  "content": [
    {
      "type": "prose",
      "format": "markdown",
      "text": "# Harvest Jacket — Walnut\n\nBuilt for daily wear and refinishing. The Harvest Jacket — Walnut is designed for the long haul, with apparel-grade materials and a quiet, considered fit and finish.\n\n## Highlights\n\n- Crafted in Italy.\n- Repairable construction with serviceable parts.\n- Backed by a one-year materials warranty.\n\n## Care\n\nCondition every 60 days for best results. Spot-clean only; avoid harsh detergents. Store in a cool, dry place out of direct sunlight.",
      "metadata": {
        "extracted_via": "adapter"
      }
    },
    {
      "type": "data",
      "format": "json",
      "text": "{\"weight_g\":1316,\"materials\":{\"upper\":\"recycled paper\",\"sole\":\"cloth binding\",\"lining\":\"lay-flat spine\"},\"care\":\"wipe with a damp cloth\",\"made_in\":\"Italy\",\"sizes_us\":[8,8.5,9,9.5,10,10.5,11,11.5,12]}",
      "value": {
        "weight_g": 1316,
        "materials": {
          "upper": "recycled paper",
          "sole": "cloth binding",
          "lining": "lay-flat spine"
        },
        "care": "wipe with a damp cloth",
        "made_in": "Italy",
        "sizes_us": [
          8,
          8.5,
          9,
          9.5,
          10,
          10.5,
          11,
          11.5,
          12
        ]
      },
      "metadata": {
        "extracted_via": "adapter"
      }
    }
  ],
  "related": [
    {
      "id": "sku-000097",
      "relation": "see-also"
    },
    {
      "id": "sku-000105",
      "relation": "see-also"
    },
    {
      "id": "sku-000113",
      "relation": "see-also"
    },
    {
      "id": "sku-000121",
      "relation": "see-also"
    },
    {
      "id": "sku-000137",
      "relation": "see-also"
    },
    {
      "id": "sku-000145",
      "relation": "see-also"
    },
    {
      "id": "sku-000153",
      "relation": "see-also"
    },
    {
      "id": "sku-000161",
      "relation": "see-also"
    }
  ],
  "metadata": {
    "schema_org_type": "Product",
    "tags": [
      "apparel",
      "made-in-italy",
      "walnut"
    ],
    "source": {
      "adapter": "act-catalog",
      "source_id": "sku-000129"
    }
  }
}