{
  "act_version": "0.1",
  "id": "sku-000029",
  "type": "product",
  "title": "Embered Notebook — Ochre",
  "summary": "Embered notebook in ochre; built in Italy for daily use.",
  "summary_source": "author",
  "parent": "catalog",
  "etag": "s256:IjmRg8d-kfh6qnSABVzIJE",
  "tokens": {
    "summary": 10,
    "body": 83
  },
  "content": [
    {
      "type": "prose",
      "format": "markdown",
      "text": "# Embered Notebook — Ochre\n\nBuilt for daily wear and refinishing. The Embered Notebook — Ochre is designed for the long haul, with office-grade materials and a quiet, considered fit and finish.\n\n## Highlights\n\n- Crafted in Italy.\n- Repairable construction with serviceable parts.\n- Backed by a one-year materials warranty.\n\n## Care\n\nCondition every 60 days for best results. Spot-clean only; avoid harsh detergents. Store in a cool, dry place out of direct sunlight.",
      "metadata": {
        "extracted_via": "adapter"
      }
    },
    {
      "type": "data",
      "format": "json",
      "text": "{\"weight_g\":965,\"materials\":{\"upper\":\"steel chassis\",\"sole\":\"machined aluminum\",\"lining\":\"frosted glass\"},\"care\":\"wipe with a damp cloth\",\"made_in\":\"Italy\",\"page_count\":102}",
      "value": {
        "weight_g": 965,
        "materials": {
          "upper": "steel chassis",
          "sole": "machined aluminum",
          "lining": "frosted glass"
        },
        "care": "wipe with a damp cloth",
        "made_in": "Italy",
        "page_count": 102
      },
      "metadata": {
        "extracted_via": "adapter"
      }
    }
  ],
  "related": [
    {
      "id": "sku-000005",
      "relation": "see-also"
    },
    {
      "id": "sku-000013",
      "relation": "see-also"
    },
    {
      "id": "sku-000021",
      "relation": "see-also"
    },
    {
      "id": "sku-000037",
      "relation": "see-also"
    },
    {
      "id": "sku-000045",
      "relation": "see-also"
    },
    {
      "id": "sku-000053",
      "relation": "see-also"
    },
    {
      "id": "sku-000061",
      "relation": "see-also"
    }
  ],
  "metadata": {
    "schema_org_type": "Product",
    "tags": [
      "office",
      "made-in-italy",
      "ochre"
    ],
    "source": {
      "adapter": "act-catalog",
      "source_id": "sku-000029"
    }
  }
}