{
  "act_version": "0.1",
  "id": "sku-000301",
  "type": "product",
  "title": "Field Notebook — Charcoal",
  "summary": "Field notebook in charcoal; built in Portugal for daily use.",
  "summary_source": "author",
  "parent": "catalog",
  "etag": "s256:b61pqyrFcCzIowHzJaR7EL",
  "tokens": {
    "summary": 10,
    "body": 83
  },
  "content": [
    {
      "type": "prose",
      "format": "markdown",
      "text": "# Field Notebook — Charcoal\n\nBuilt for daily wear and refinishing. The Field Notebook — Charcoal is designed for the long haul, with office-grade materials and a quiet, considered fit and finish.\n\n## Highlights\n\n- Crafted in Portugal.\n- Repairable construction with serviceable parts.\n- Backed by a one-year materials warranty.\n\n## Care\n\nCondition every 60 days for best results. Spot-clean only; avoid harsh detergents. Store in a cool, dry place out of direct sunlight.",
      "metadata": {
        "extracted_via": "adapter"
      }
    },
    {
      "type": "data",
      "format": "json",
      "text": "{\"weight_g\":1264,\"materials\":{\"upper\":\"recycled paper\",\"sole\":\"cloth binding\",\"lining\":\"lay-flat spine\"},\"care\":\"wipe with a damp cloth\",\"made_in\":\"Portugal\",\"page_count\":131}",
      "value": {
        "weight_g": 1264,
        "materials": {
          "upper": "recycled paper",
          "sole": "cloth binding",
          "lining": "lay-flat spine"
        },
        "care": "wipe with a damp cloth",
        "made_in": "Portugal",
        "page_count": 131
      },
      "metadata": {
        "extracted_via": "adapter"
      }
    }
  ],
  "related": [
    {
      "id": "sku-000269",
      "relation": "see-also"
    },
    {
      "id": "sku-000277",
      "relation": "see-also"
    },
    {
      "id": "sku-000285",
      "relation": "see-also"
    },
    {
      "id": "sku-000293",
      "relation": "see-also"
    },
    {
      "id": "sku-000309",
      "relation": "see-also"
    },
    {
      "id": "sku-000317",
      "relation": "see-also"
    },
    {
      "id": "sku-000325",
      "relation": "see-also"
    },
    {
      "id": "sku-000333",
      "relation": "see-also"
    }
  ],
  "metadata": {
    "schema_org_type": "Product",
    "tags": [
      "office",
      "made-in-portugal",
      "charcoal"
    ],
    "source": {
      "adapter": "act-catalog",
      "source_id": "sku-000301"
    }
  }
}