{
  "act_version": "0.1",
  "id": "recipes/archival/archive-audit-trail-sdk-node",
  "type": "recipe",
  "title": "Archive audit trail sdk node (Archival)",
  "summary": "Archive audit trail sdk node — archival workflow walkthrough.",
  "summary_source": "author",
  "content": [
    {
      "type": "prose",
      "format": "markdown",
      "text": "Goal"
    },
    {
      "type": "prose",
      "format": "markdown",
      "text": "Demonstrate \"archive audit trail (sdk node)\" against the Tinybox archival surface end to end."
    },
    {
      "type": "prose",
      "format": "markdown",
      "text": "Walkthrough"
    },
    {
      "type": "code",
      "language": "bash",
      "text": "# Step 1 — prepare a bucket for the archival workflow.\ntinybox buckets create my-bucket --region us-east-1"
    },
    {
      "type": "prose",
      "format": "markdown",
      "text": "Apply the recipe; verify with the API reference under API reference."
    }
  ],
  "tokens": {
    "summary": 9,
    "body": 48
  },
  "metadata": {
    "source": {
      "adapter": "act-docusaurus-sidebar-synthesizer",
      "source_id": "recipes/archival/archive-audit-trail-sdk-node.md",
      "source_path": "/Users/jforsythe/dev/ai/act/examples/docusaurus-docs/docs/recipes/archival/archive-audit-trail-sdk-node.md"
    }
  },
  "etag": "s256:OTp8h9cdhEM8bgmbh7RBE7",
  "parent": "archival"
}